{
  "input_snapshot_id": "snap_01KDVDNAZ83BAMMYCEGWF33DPM",
  "domain": "finance",
  "domain_schema_version": "1.0",
  "dataset": {
    "dataset_id": "finance/etf-daily/SPY",
    "dataset_version": "fixture-1"
  },
  "manifest_checksum": "sha256:3376031888b67b8ee373c67e79122557a5be99be28c45645806f00c130160e86",
  "source_timestamps": {
    "earliest": "2026-01-02T21:00:00Z",
    "latest": "2026-01-09T21:00:00Z"
  },
  "lineage": {
    "provider": "mock",
    "retrieved_at": "2026-01-10T13:00:00Z"
  },
  "coverage": {
    "start": "2026-01-02",
    "end": "2026-01-09"
  },
  "quality_flags": [],
  "status": "approved",
  "approval_rule_version": "auto-approve-v1",
  "artifacts": [
    {
      "artifact_id": "art_01KDVDNMQRGZCENY514M1YB22J",
      "owner": "financialplanning",
      "kind": "snapshot_manifest",
      "checksum": "sha256:b8f49193a276fceb387334fe0212a33c007a9be61088bb879da85e770abbc25e",
      "content_type": "application/json"
    },
    {
      "artifact_id": "art_01KDVDNNQ0XZ1J9JVZCJ8BFXYS",
      "owner": "financialplanning",
      "kind": "snapshot_payload",
      "checksum": "sha256:ef150ae0b79fe4d8e2d51eb8486f12b972d14809333f69d360f024524cbd85fe",
      "content_type": "application/json"
    }
  ],
  "created_at": "2026-01-10T13:05:00Z",
  "synthetic": true
}
